{
  "$schema": "https://json-schema.org/draft/2020-12/schema",
  "$id": "evidence-v1/schema.json",
  "title": "Attempt evidence (evidence.json)",
  "type": "object",
  "additionalProperties": false,
  "required": ["v", "attempt_id", "harness_kind", "captured", "reason", "base_commit", "head_commit", "worktree_dirty", "files", "patch", "brief", "branch", "terminal_reason", "usage"],
  "properties": {
    "v": {"const": "1"},
    "attempt_id": {"type": "string"},
    "harness_kind": {"type": "string"},
    "captured": {"type": "boolean", "description": "false when git could not be read; then reason is set and head_commit, worktree_dirty and patch are null."},
    "reason": {"type": ["string", "null"]},
    "base_commit": {"type": "string", "description": "The commit the workspace's base_revision resolved to when git evidence exists; the requested name otherwise."},
    "base_revision_requested": {"type": "string", "description": "The base_revision the request named, as asked. Optional."},
    "head_commit": {"type": ["string", "null"], "description": "The commit the work ends at: branch.head_commit when the runner published a branch, otherwise git rev-parse HEAD (the harness may have committed)."},
    "worktree_dirty": {"type": ["boolean", "null"], "description": "The staged diff against head_commit is non-empty; false once the runner committed the work to a published branch."},
    "files": {
      "type": "array",
      "items": {
        "type": "object",
        "additionalProperties": false,
        "required": ["path", "op"],
        "properties": {
          "path": {"type": "string"},
          "op": {"enum": ["added", "modified", "deleted", "renamed"]}
        }
      }
    },
    "patch": {
      "type": ["object", "null"],
      "additionalProperties": false,
      "required": ["sha256", "size_bytes", "truncated"],
      "properties": {
        "sha256": {"type": "string", "pattern": "^[0-9a-f]{64}$"},
        "size_bytes": {"type": "integer", "minimum": 0, "maximum": 8388608},
        "truncated": {"type": "boolean", "description": "The diff exceeded 8 MiB and was cut."}
      }
    },
    "brief": {"description": "The item brief the request carried (brief-v1), also staged as brief.json; null when the item had none."},
    "branch": {"description": "Filled by the branch-push task; null until then."},
    "terminal_reason": {},
    "usage": {}
  }
}
